[
  {
    "id": "MOD-001",
    "slug": "identity",
    "name": "Identity Module",
    "scope": "Core",
    "reusability": "Global",
    "stability": "Stable",
    "owner": "Engineering",
    "sourceStandard": "2.3",
    "dependencies": [],
    "usedByProducts": [],
    "createdAt": "2026-02-10"
  },
  {
    "id": "MOD-002",
    "slug": "authentication",
    "name": "Authentication Module",
    "scope": "Core",
    "reusability": "Global",
    "stability": "Stable",
    "owner": "Engineering",
    "sourceStandard": "2.3",
    "dependencies": ["MOD-001"],
    "usedByProducts": [],
    "createdAt": "2026-02-10"
  },
  {
    "id": "MOD-003",
    "slug": "authorization",
    "name": "Authorization Module",
    "scope": "Core",
    "reusability": "Global",
    "stability": "Stable",
    "owner": "Engineering",
    "sourceStandard": "2.4",
    "dependencies": ["MOD-001"],
    "usedByProducts": [],
    "createdAt": "2026-02-10"
  },
  {
    "id": "MOD-004",
    "slug": "api-gateway",
    "name": "API Gateway Module",
    "scope": "Platform",
    "reusability": "Global",
    "stability": "Stable",
    "owner": "Engineering",
    "sourceStandard": "5.2",
    "dependencies": ["MOD-002", "MOD-003", "MOD-019"],
    "usedByProducts": [],
    "createdAt": "2026-02-10"
  },
  {
    "id": "MOD-005",
    "slug": "identifier",
    "name": "Identifier Module",
    "scope": "Core",
    "reusability": "Global",
    "stability": "Stable",
    "owner": "Engineering",
    "sourceStandard": "5.1",
    "dependencies": [],
    "usedByProducts": [],
    "createdAt": "2026-02-10"
  },
  {
    "id": "MOD-006",
    "slug": "data-classification",
    "name": "Data Classification Module",
    "scope": "Core",
    "reusability": "Global",
    "stability": "Stable",
    "owner": "Engineering",
    "sourceStandard": "3.3",
    "dependencies": [],
    "usedByProducts": [],
    "createdAt": "2026-02-10"
  },
  {
    "id": "MOD-007",
    "slug": "soft-delete",
    "name": "Soft-Delete Module",
    "scope": "Core",
    "reusability": "Global",
    "stability": "Stable",
    "owner": "Engineering",
    "sourceStandard": "3.5",
    "dependencies": [],
    "usedByProducts": [],
    "createdAt": "2026-02-10"
  },
  {
    "id": "MOD-008",
    "slug": "records-management",
    "name": "Records Management Module",
    "scope": "Governance",
    "reusability": "Global",
    "stability": "Stable",
    "owner": "Engineering",
    "sourceStandard": "3.8",
    "dependencies": ["MOD-006", "MOD-007"],
    "usedByProducts": [],
    "createdAt": "2026-02-10"
  },
  {
    "id": "MOD-009",
    "slug": "audit-log",
    "name": "Audit Log Module",
    "scope": "Core",
    "reusability": "Global",
    "stability": "Stable",
    "owner": "Engineering",
    "sourceStandard": "4.5",
    "dependencies": ["MOD-011"],
    "usedByProducts": [],
    "createdAt": "2026-02-10"
  },
  {
    "id": "MOD-010",
    "slug": "multi-tenancy",
    "name": "Multi-Tenancy Module",
    "scope": "Platform",
    "reusability": "Global",
    "stability": "Stable",
    "owner": "Engineering",
    "sourceStandard": "3.4",
    "dependencies": ["MOD-003"],
    "usedByProducts": [],
    "createdAt": "2026-02-10"
  },
  {
    "id": "MOD-011",
    "slug": "logging",
    "name": "Logging Module",
    "scope": "Platform",
    "reusability": "Global",
    "stability": "Stable",
    "owner": "SRE",
    "sourceStandard": "4.5",
    "dependencies": [],
    "usedByProducts": [],
    "createdAt": "2026-02-10"
  },
  {
    "id": "MOD-012",
    "slug": "metrics",
    "name": "Metrics Module",
    "scope": "Platform",
    "reusability": "Global",
    "stability": "Stable",
    "owner": "SRE",
    "sourceStandard": "4.5",
    "dependencies": [],
    "usedByProducts": [],
    "createdAt": "2026-02-10"
  },
  {
    "id": "MOD-013",
    "slug": "tracing",
    "name": "Tracing Module",
    "scope": "Platform",
    "reusability": "Global",
    "stability": "Stable",
    "owner": "SRE",
    "sourceStandard": "4.5",
    "dependencies": [],
    "usedByProducts": [],
    "createdAt": "2026-02-10"
  },
  {
    "id": "MOD-014",
    "slug": "alerting",
    "name": "Alerting Module",
    "scope": "Platform",
    "reusability": "Global",
    "stability": "Stable",
    "owner": "SRE",
    "sourceStandard": "4.5",
    "dependencies": ["MOD-012"],
    "usedByProducts": [],
    "createdAt": "2026-02-10"
  },
  {
    "id": "MOD-015",
    "slug": "health-check",
    "name": "Health Check Module",
    "scope": "Platform",
    "reusability": "Global",
    "stability": "Stable",
    "owner": "SRE",
    "sourceStandard": "4.4",
    "dependencies": [],
    "usedByProducts": [],
    "createdAt": "2026-02-10"
  },
  {
    "id": "MOD-016",
    "slug": "cryptography",
    "name": "Cryptography Module",
    "scope": "Core",
    "reusability": "Global",
    "stability": "Stable",
    "owner": "Security",
    "sourceStandard": "2.5",
    "dependencies": [],
    "usedByProducts": [],
    "createdAt": "2026-02-10"
  },
  {
    "id": "MOD-017",
    "slug": "secret-management",
    "name": "Secret Management Module",
    "scope": "Core",
    "reusability": "Global",
    "stability": "Stable",
    "owner": "Security",
    "sourceStandard": "2.5",
    "dependencies": ["MOD-016"],
    "usedByProducts": [],
    "createdAt": "2026-02-10"
  },
  {
    "id": "MOD-018",
    "slug": "input-validation",
    "name": "Input Validation Module",
    "scope": "Core",
    "reusability": "Global",
    "stability": "Stable",
    "owner": "Security",
    "sourceStandard": "2.2",
    "dependencies": [],
    "usedByProducts": [],
    "createdAt": "2026-02-10"
  },
  {
    "id": "MOD-019",
    "slug": "rate-limiting",
    "name": "Rate Limiting Module",
    "scope": "Platform",
    "reusability": "Global",
    "stability": "Stable",
    "owner": "Engineering",
    "sourceStandard": "5.2",
    "dependencies": [],
    "usedByProducts": [],
    "createdAt": "2026-02-10"
  },
  {
    "id": "MOD-020",
    "slug": "security-headers",
    "name": "Security Headers Module",
    "scope": "Core",
    "reusability": "Global",
    "stability": "Stable",
    "owner": "Security",
    "sourceStandard": "2.2",
    "dependencies": [],
    "usedByProducts": [],
    "createdAt": "2026-02-10"
  },
  {
    "id": "MOD-021",
    "slug": "webhook",
    "name": "Webhook Module",
    "scope": "Integration",
    "reusability": "Global",
    "stability": "Stable",
    "owner": "Engineering",
    "sourceStandard": "5.3",
    "dependencies": [],
    "usedByProducts": [],
    "createdAt": "2026-02-10"
  },
  {
    "id": "MOD-022",
    "slug": "notification",
    "name": "Notification Module",
    "scope": "Domain",
    "reusability": "Global",
    "stability": "Stable",
    "owner": "Engineering",
    "sourceStandard": "4.3",
    "dependencies": ["MOD-023"],
    "usedByProducts": [],
    "createdAt": "2026-02-10"
  },
  {
    "id": "MOD-023",
    "slug": "email",
    "name": "Email Module",
    "scope": "Integration",
    "reusability": "Global",
    "stability": "Stable",
    "owner": "Engineering",
    "sourceStandard": "2.3",
    "dependencies": [],
    "usedByProducts": [],
    "createdAt": "2026-02-10"
  },
  {
    "id": "MOD-024",
    "slug": "file-upload",
    "name": "File Upload Module",
    "scope": "Domain",
    "reusability": "Global",
    "stability": "Stable",
    "owner": "Engineering",
    "sourceStandard": "5.2",
    "dependencies": ["MOD-018"],
    "usedByProducts": [],
    "createdAt": "2026-02-10"
  },
  {
    "id": "MOD-025",
    "slug": "incident-management",
    "name": "Incident Management Module",
    "scope": "Governance",
    "reusability": "Global",
    "stability": "Stable",
    "owner": "SRE",
    "sourceStandard": "4.3",
    "dependencies": ["MOD-022", "MOD-014"],
    "usedByProducts": [],
    "createdAt": "2026-02-10"
  },
  {
    "id": "MOD-026",
    "slug": "change-management",
    "name": "Change Management Module",
    "scope": "Governance",
    "reusability": "Global",
    "stability": "Stable",
    "owner": "Engineering",
    "sourceStandard": "5.7",
    "dependencies": ["MOD-009"],
    "usedByProducts": [],
    "createdAt": "2026-02-10"
  },
  {
    "id": "MOD-027",
    "slug": "feature-flag",
    "name": "Feature Flag Module",
    "scope": "Platform",
    "reusability": "Global",
    "stability": "Stable",
    "owner": "Engineering",
    "sourceStandard": "5.6",
    "dependencies": [],
    "usedByProducts": [],
    "createdAt": "2026-02-10"
  },
  {
    "id": "MOD-028",
    "slug": "backup",
    "name": "Backup Module",
    "scope": "Platform",
    "reusability": "Global",
    "stability": "Stable",
    "owner": "SRE",
    "sourceStandard": "4.2",
    "dependencies": [],
    "usedByProducts": [],
    "createdAt": "2026-02-10"
  },
  {
    "id": "MOD-029",
    "slug": "ai-intelligence",
    "name": "AI Intelligence Module",
    "scope": "Platform",
    "reusability": "Global",
    "stability": "Experimental",
    "owner": "Engineering",
    "sourceStandard": "7.2",
    "dependencies": ["MOD-002", "MOD-003", "MOD-004", "MOD-005", "MOD-006", "MOD-009", "MOD-010", "MOD-011", "MOD-012", "MOD-013", "MOD-017", "MOD-018", "MOD-019"],
    "usedByProducts": [],
    "createdAt": "2026-02-16"
  },
  {
    "id": "MOD-030",
    "slug": "project-analyzer",
    "name": "Project Analyzer Module",
    "scope": "Governance",
    "reusability": "Product",
    "stability": "Experimental",
    "owner": "Engineering",
    "sourceStandard": "2.2",
    "dependencies": ["MOD-005", "MOD-011", "MOD-018"],
    "usedByProducts": ["PRD-002"],
    "createdAt": "2026-02-18"
  },
  {
    "id": "MOD-031",
    "slug": "governance-console-core",
    "name": "Governance Console Core",
    "scope": "Governance",
    "reusability": "Product",
    "stability": "Experimental",
    "owner": "Engineering",
    "sourceStandard": "5.1",
    "dependencies": ["MOD-032"],
    "usedByProducts": ["PRD-002"],
    "createdAt": "2026-02-24"
  },
  {
    "id": "MOD-032",
    "slug": "enterprise-governance-engine",